{
  "$schema": "https://json-schema.org/draft/2020-12/schema",
  "$id": "https://example.com/ods-app.schema.json",
  "title": "ODS Application Schema",
  "description": "Defines the structure for a dynamic application rendered from a JSON definition.",
  "type": "object",
  "properties": {
    "appName": {
      "description": "The display name of the application.",
      "type": "string"
    },
    "startPage": {
      "description": "The ID of the page to load when the app starts.",
      "type": "string"
    },
    "auth": {
      "description": "RESERVED FOR FUTURE USE: Defines authentication requirements for the app.",
      "type": "object"
    },
    "menu": {
      "description": "Defines the primary navigation menu.",
      "type": "array",
      "items": {
        "type": "object",
        "properties": {
          "label": { "type": "string" },
          "mapsTo": { "type": "string" }
        },
        "required": ["label", "mapsTo"]
      }
    },
    "pages": {
      "description": "A dictionary of all pages available in the application.",
      "type": "object",
      "additionalProperties": { "$ref": "#/$defs/page" }
    },
    "dataSources": {
      "description": "A dictionary of all data sources used by the application. Each key is a unique identifier referenced by components and actions.",
      "type": "object",
      "additionalProperties": { "$ref": "#/$defs/dataSource" }
    },
    "help": {
      "description": "Optional. Provides help and guidance content for the application.",
      "$ref": "#/$defs/helpObject"
    },
    "tour": {
      "description": "Optional. Defines a guided tour shown on first launch to introduce the user to the app.",
      "type": "array",
      "items": { "$ref": "#/$defs/tourStep" }
    }
  },
  "required": ["appName", "startPage", "pages"],
  "$defs": {
    "helpObject": {
      "title": "Help Object",
      "description": "Provides help content for the application. Includes an overview and optional per-page help.",
      "type": "object",
      "properties": {
        "overview": {
          "description": "A general description of what the app does and how to use it.",
          "type": "string"
        },
        "pages": {
          "description": "Per-page help text, keyed by page ID.",
          "type": "object",
          "additionalProperties": { "type": "string" }
        }
      },
      "required": ["overview"]
    },
    "tourStep": {
      "title": "Tour Step",
      "description": "A single step in the guided tour.",
      "type": "object",
      "properties": {
        "title": {
          "description": "The title of this tour step.",
          "type": "string"
        },
        "content": {
          "description": "The explanatory text for this tour step.",
          "type": "string"
        },
        "page": {
          "description": "Optional. The page ID to navigate to for this step, so the user sees the relevant page.",
          "type": "string"
        }
      },
      "required": ["title", "content"]
    },
    "dataSource": {
      "title": "DataSource Object",
      "description": "Defines a data endpoint. Use 'local://<tableName>' for framework-managed local storage, or a full URL (https://) for external REST APIs.",
      "type": "object",
      "properties": {
        "url": {
          "description": "The data endpoint. Use 'local://<tableName>' for local storage managed by the framework, or a full URL for an external API.",
          "type": "string"
        },
        "method": {
          "description": "The access method. For local:// sources, GET reads all rows, POST inserts a new row, and PUT updates an existing row. For external URLs, this is the HTTP method.",
          "type": "string",
          "enum": ["GET", "POST", "PUT"]
        },
        "fields": {
          "description": "Optional. Explicitly defines the columns/fields for a local:// data source. If omitted for a local:// source, the schema is auto-inferred from the first form that submits to it.",
          "type": "array",
          "items": { "$ref": "#/$defs/fieldDefinition" }
        },
        "seedData": {
          "description": "Optional. An array of objects to pre-populate a local:// data source when the table is first created. Each object's keys must match the field names.",
          "type": "array",
          "items": {
            "type": "object",
            "additionalProperties": true
          }
        }
      },
      "required": ["url", "method"]
    },
    "fieldDefinition": {
      "title": "Field Definition",
      "description": "Defines a single field/column in a data source or form.",
      "type": "object",
      "properties": {
        "name": {
          "description": "The programmatic name of the field, used as the column name in storage.",
          "type": "string"
        },
        "type": {
          "description": "The data type of the field. Used for input widget selection and display formatting.",
          "type": "string",
          "enum": ["text", "email", "number", "date", "multiline", "select", "checkbox"]
        },
        "options": {
          "description": "Required when type is 'select'. An array of string values the user can choose from, rendered as a dropdown.",
          "type": "array",
          "items": { "type": "string" }
        },
        "label": {
          "description": "Optional. A human-readable label for the field.",
          "type": "string"
        },
        "required": {
          "description": "Optional. When true, the field must have a non-empty value before the form can be submitted. Defaults to false.",
          "type": "boolean",
          "default": false
        },
        "placeholder": {
          "description": "Optional. Example or hint text shown inside the field when it is empty. Disappears once the user starts typing.",
          "type": "string"
        },
        "default": {
          "description": "Optional. A default value to pre-fill the field with when the form is first displayed. The user can change it.",
          "type": "string"
        }
      },
      "required": ["name", "type"]
    },
    "page": {
      "title": "Page Object",
      "type": "object",
      "properties": {
        "component": { "const": "page" },
        "title": { "description": "The title displayed for the page.", "type": "string" },
        "content": {
          "description": "An array of components to render on the page.",
          "type": "array",
          "items": {
            "oneOf": [
              { "$ref": "#/$defs/textComponent" },
              { "$ref": "#/$defs/listComponent" },
              { "$ref": "#/$defs/formComponent" },
              { "$ref": "#/$defs/buttonComponent" }
            ]
          }
        }
      },
      "required": ["component", "title", "content"]
    },
    "textComponent": {
      "title": "Text Component",
      "type": "object",
      "properties": {
        "component": { "const": "text" },
        "content": { "type": "string" },
        "styleHint": { "$ref": "#/$defs/styleHint" }
      },
      "required": ["component", "content"]
    },
    "listComponent": {
      "title": "List Component",
      "type": "object",
      "properties": {
        "component": { "const": "list" },
        "dataSource": { "description": "The ID of the dataSource to read data from.", "type": "string" },
        "columns": {
          "type": "array",
          "items": {
            "type": "object",
            "properties": {
              "header": { "type": "string" },
              "field": { "type": "string" },
              "sortable": {
                "description": "Optional. When true, the column header becomes tappable to sort the list by this field. Defaults to false.",
                "type": "boolean",
                "default": false
              }
            },
            "required": ["header", "field"]
          }
        },
        "rowActions": {
          "description": "Optional. An array of actions rendered as buttons in each row. Allows inline operations like marking a task done without navigating to a separate page.",
          "type": "array",
          "items": { "$ref": "#/$defs/rowAction" }
        },
        "styleHint": { "$ref": "#/$defs/styleHint" }
      },
      "required": ["component", "dataSource", "columns"]
    },
    "formComponent": {
      "title": "Form Component",
      "type": "object",
      "properties": {
        "component": { "const": "form" },
        "id": { "description": "A unique identifier for the form.", "type": "string" },
        "fields": {
          "type": "array",
          "items": { "$ref": "#/$defs/fieldDefinition" }
        },
        "styleHint": { "$ref": "#/$defs/styleHint" }
      },
      "required": ["component", "id", "fields"]
    },
    "buttonComponent": {
      "title": "Button Component",
      "type": "object",
      "properties": {
        "component": { "const": "button" },
        "label": { "type": "string" },
        "onClick": {
          "type": "array",
          "items": { "$ref": "#/$defs/action" }
        },
        "styleHint": { "$ref": "#/$defs/styleHint" }
      },
      "required": ["component", "label", "onClick"]
    },
    "action": {
      "title": "Action Object",
      "description": "Defines an action to be performed: navigate (go to a page), submit (insert a new row), or update (modify an existing row).",
      "type": "object",
      "oneOf": [
        {
          "properties": {
            "action": { "const": "navigate" },
            "target": { "description": "The ID of the page to navigate to.", "type": "string" },
            "withData": {
              "description": "An optional object of data to pass to the target page.",
              "type": "object",
              "additionalProperties": true
            }
          },
          "required": ["action", "target"]
        },
        {
          "properties": {
            "action": { "const": "submit" },
            "dataSource": { "description": "The ID of the dataSource to submit to.", "type": "string" },
            "target": { "description": "The ID of the form to submit.", "type": "string" }
          },
          "required": ["action", "dataSource", "target"]
        },
        {
          "properties": {
            "action": { "const": "update" },
            "dataSource": { "description": "The ID of the PUT dataSource to update.", "type": "string" },
            "target": { "description": "The ID of the form whose values provide the update data.", "type": "string" },
            "matchField": { "description": "The field name used to find the row to update. The row where this field matches the form value is updated.", "type": "string" }
          },
          "required": ["action", "dataSource", "target", "matchField"]
        }
      ]
    },
    "rowAction": {
      "title": "Row Action",
      "description": "An action button rendered in each row of a list. Uses the row's own data to identify which record to act on.",
      "type": "object",
      "properties": {
        "label": {
          "description": "The text shown on the action button in each row.",
          "type": "string"
        },
        "action": {
          "description": "The action type. Currently only 'update' is supported for row actions.",
          "type": "string",
          "enum": ["update"]
        },
        "dataSource": {
          "description": "The ID of the PUT dataSource to perform the update.",
          "type": "string"
        },
        "matchField": {
          "description": "The field name used to identify the row. The value is taken from the row's own data.",
          "type": "string"
        },
        "values": {
          "description": "A map of field names to values to set when the action is triggered.",
          "type": "object",
          "additionalProperties": { "type": "string" }
        }
      },
      "required": ["label", "action", "dataSource", "matchField", "values"]
    },
    "styleHint": {
      "title": "StyleHint Object",
      "description": "An optional object providing abstract styling guidance. Frameworks should interpret known hints and gracefully ignore unknown ones.",
      "type": "object",
      "additionalProperties": true
    }
  }
}
