{
  "appName": "Customer Feedback",
  "startPage": "feedbackFormPage",
  "menu": [
    { "label": "Submit Feedback", "mapsTo": "feedbackFormPage" },
    { "label": "View Responses", "mapsTo": "viewFeedbackPage" }
  ],
  "pages": {
    "feedbackFormPage": {
      "component": "page",
      "title": "We Value Your Feedback",
      "content": [
        {
          "component": "text",
          "content": "Please let us know how we're doing. Your feedback helps us improve our service.",
          "styleHint": {
            "variant": "body"
          }
        },
        {
          "component": "form",
          "id": "feedbackForm",
          "fields": [
            { "name": "customerName", "label": "Your Name", "type": "text" },
            { "name": "customerEmail", "label": "Email Address", "type": "email" },
            { "name": "rating", "label": "Rating (1-5)", "type": "number" },
            { "name": "comments", "label": "Comments", "type": "text" }
          ]
        },
        {
          "component": "button",
          "label": "Submit Feedback",
          "onClick": [
            {
              "action": "submit",
              "dataSource": "feedbackStore",
              "target": "feedbackForm"
            },
            {
              "action": "navigate",
              "target": "thankYouPage"
            }
          ],
          "styleHint": {
            "emphasis": "primary"
          }
        }
      ]
    },
    "thankYouPage": {
      "component": "page",
      "title": "Thank You!",
      "content": [
        {
          "component": "text",
          "content": "Your feedback has been submitted successfully. We appreciate you taking the time to help us.",
          "styleHint": {
            "variant": "heading"
          }
        },
        {
          "component": "button",
          "label": "Submit Another Response",
          "onClick": [
            {
              "action": "navigate",
              "target": "feedbackFormPage"
            }
          ]
        }
      ]
    },
    "viewFeedbackPage": {
      "component": "page",
      "title": "All Feedback",
      "content": [
        {
          "component": "text",
          "content": "Below is all feedback that has been submitted.",
          "styleHint": {
            "variant": "body"
          }
        },
        {
          "component": "list",
          "dataSource": "feedbackReader",
          "columns": [
            { "header": "Name", "field": "customerName" },
            { "header": "Email", "field": "customerEmail" },
            { "header": "Rating", "field": "rating" },
            { "header": "Comments", "field": "comments" }
          ]
        },
        {
          "component": "button",
          "label": "Back to Form",
          "onClick": [
            {
              "action": "navigate",
              "target": "feedbackFormPage"
            }
          ]
        }
      ]
    }
  },
  "dataSources": {
    "feedbackStore": {
      "url": "local://feedback",
      "method": "POST"
    },
    "feedbackReader": {
      "url": "local://feedback",
      "method": "GET"
    }
  }
}
